[
  {
    "obra_id": "550e8400-e29b-41d4-a716-446655440001",
    "codigo_obra": "227",
    "nombre_obra": "CASTELLO E",
    "cliente": "Desarrolladora Inmobiliaria Los Arcos S.A. de C.V.",
    "residente": "Ing. Miguel Torres Hernández",
    "estado": "activa",
    "monto_original_contrato": 15000000.00,
    "total_aditivas": 500000.00,
    "total_deductivas": 150000.00,
    "monto_contratado": 15350000.00,
    "monto_comprometido": 67628.00,
    "monto_pagado": 20000.00,
    "saldo_disponible": 15282372.00,
    "porcentaje_ejercido": 0.44,
    "total_estimaciones": 0.00,
    "avance_fisico_porcentaje": 0.00,
    "estado_financiero": "saludable",
    "dias_transcurridos": 15,
    "dias_restantes": 320,
    "porcentaje_tiempo_transcurrido": 4.48
  },
  {
    "obra_id": "550e8400-e29b-41d4-a716-446655440002",
    "codigo_obra": "228",
    "nombre_obra": "CASTELLO F",
    "cliente": "Grupo Constructor Metropolitano",
    "residente": "Ing. Laura Sánchez Morales",
    "estado": "activa",
    "monto_original_contrato": 12000000.00,
    "total_aditivas": 0.00,
    "total_deductivas": 0.00,
    "monto_contratado": 12000000.00,
    "monto_comprometido": 9860.00,
    "monto_pagado": 9860.00,
    "saldo_disponible": 11990140.00,
    "porcentaje_ejercido": 0.08,
    "total_estimaciones": 0.00,
    "avance_fisico_porcentaje": 0.00,
    "estado_financiero": "saludable",
    "dias_transcurridos": 4,
    "dias_restantes": 299,
    "porcentaje_tiempo_transcurrido": 1.32
  },
  {
    "obra_id": "550e8400-e29b-41d4-a716-446655440003",
    "codigo_obra": "229",
    "nombre_obra": "CASTELLO G",
    "cliente": "Gobierno del Estado de México",
    "residente": "Ing. Roberto García Flores",
    "estado": "activa",
    "monto_original_contrato": 8500000.00,
    "total_aditivas": 0.00,
    "total_deductivas": 0.00,
    "monto_contratado": 8500000.00,
    "monto_comprometido": 46980.00,
    "monto_pagado": 0.00,
    "saldo_disponible": 8453020.00,
    "porcentaje_ejercido": 0.55,
    "total_estimaciones": 0.00,
    "avance_fisico_porcentaje": 0.00,
    "estado_financiero": "saludable",
    "dias_transcurridos": 10,
    "dias_restantes": 234,
    "porcentaje_tiempo_transcurrido": 4.10
  },
  {
    "obra_id": "550e8400-e29b-41d4-a716-446655440004",
    "codigo_obra": "231",
    "nombre_obra": "DOZA A",
    "cliente": "Constructora Doza S.A. de C.V.",
    "residente": "Ing. Patricia Ramírez López",
    "estado": "activa",
    "monto_original_contrato": 6500000.00,
    "total_aditivas": 200000.00,
    "total_deductivas": 0.00,
    "monto_contratado": 6700000.00,
    "monto_comprometido": 13920.00,
    "monto_pagado": 0.00,
    "saldo_disponible": 6686080.00,
    "porcentaje_ejercido": 0.21,
    "total_estimaciones": 0.00,
    "avance_fisico_porcentaje": 0.00,
    "estado_financiero": "saludable",
    "dias_transcurridos": 0,
    "dias_restantes": 260,
    "porcentaje_tiempo_transcurrido": 0.00
  },
  {
    "obra_id": "550e8400-e29b-41d4-a716-446655440005",
    "codigo_obra": "232",
    "nombre_obra": "BALVANERA",
    "cliente": "Desarrollos Balvanera",
    "residente": "Ing. Carlos Mendoza Cruz",
    "estado": "activa",
    "monto_original_contrato": 9800000.00,
    "total_aditivas": 0.00,
    "total_deductivas": 0.00,
    "monto_contratado": 9800000.00,
    "monto_comprometido": 58510.40,
    "monto_pagado": 0.00,
    "saldo_disponible": 9741489.60,
    "porcentaje_ejercido": 0.60,
    "total_estimaciones": 0.00,
    "avance_fisico_porcentaje": 0.00,
    "estado_financiero": "saludable",
    "dias_transcurridos": 0,
    "dias_restantes": 303,
    "porcentaje_tiempo_transcurrido": 0.00
  }
]
